Journal,Publication Date,Title,Abstract,DOI
Nature,2024-Mar,UFM1 E3 ligase promotes recycling of 60S ribosomal subunits from the ER.,"Reversible modification of target proteins by ubiquitin and ubiquitin-like proteins (UBLs) is widely used by eukaryotic cells to control protein fate and cell behaviour<sup>1</sup>. UFM1 is a UBL that predominantly modifies a single lysine residue on a single ribosomal protein, uL24 (also called RPL26), on ribosomes at the cytoplasmic surface of the endoplasmic reticulum (ER)<sup>2,3</sup>. UFM1 conjugation (UFMylation) facilitates the rescue of 60S ribosomal subunits (60S) that are released after ribosome-associated quality-control-mediated splitting of ribosomes that stall during co-translational translocation of secretory proteins into the ER<sup>3,4</sup>. Neither the molecular mechanism by which the UFMylation machinery achieves such precise target selection nor how this ribosomal modification promotes 60S rescue is known. Here we show that ribosome UFMylation in vivo occurs on free 60S and we present sequential cryo-electron microscopy snapshots of the heterotrimeric UFM1 E3 ligase (E3(UFM1)) engaging its substrate uL24. E3(UFM1) binds the L1 stalk, empty transfer RNA-binding sites and the peptidyl transferase centre through carboxy-terminal domains of UFL1, which results in uL24 modification more than 150 Å away. After catalysing UFM1 transfer, E3(UFM1) remains stably bound to its product, UFMylated 60S, forming a C-shaped clamp that extends all the way around the 60S from the transfer RNA-binding sites to the polypeptide tunnel exit. Our structural and biochemical analyses suggest a role for E3(UFM1) in post-termination release and recycling of the large ribosomal subunit from the ER membrane.",https://doi.org/10.1038/s41586-024-07073-0
Nature,2024-Mar,Room temperature operation of germanium-silicon single-photon avalanche diode.,"The ability to detect single photons has led to the advancement of numerous research fields<sup>1-11</sup>. Although various types of single-photon detector have been developed<sup>12</sup>, because of two main factors-that is, (1) the need for operating at cryogenic temperature<sup>13,14</sup> and (2) the incompatibility with complementary metal-oxide-semiconductor (CMOS) fabrication processes<sup>15,16</sup>-so far, to our knowledge, only Si-based single-photon avalanche diode (SPAD)<sup>17,18</sup> has gained mainstream success and has been used in consumer electronics. With the growing demand to shift the operation wavelength from near-infrared to short-wavelength infrared (SWIR) for better safety and performance<sup>19-21</sup>, an alternative solution is required because Si has negligible optical absorption for wavelengths beyond 1 µm. Here we report a CMOS-compatible, high-performing germanium-silicon SPAD operated at room temperature, featuring a noise-equivalent power improvement over the previous Ge-based SPADs<sup>22-28</sup> by 2-3.5 orders of magnitude. Key parameters such as dark count rate, single-photon detection probability at 1,310 nm, timing jitter, after-pulsing characteristic time and after-pulsing probability are, respectively, measured as 19 kHz µm<sup>-2</sup>, 12%, 188 ps, ~90 ns and <1%, with a low breakdown voltage of 10.26 V and a small excess bias of 0.75 V. Three-dimensional point-cloud images are captured with direct time-of-flight technique as proof of concept. This work paves the way towards using single-photon-sensitive SWIR sensors, imagers and photonic integrated circuits in everyday life.",https://doi.org/10.1038/s41586-024-07076-x
Nature,2024-Mar,Evolutionary novelties underlie sound production in baleen whales.,"Baleen whales (mysticetes) use vocalizations to mediate their complex social and reproductive behaviours in vast, opaque marine environments<sup>1</sup>. Adapting to an obligate aquatic lifestyle demanded fundamental physiological changes to efficiently produce sound, including laryngeal specializations<sup>2-4</sup>. Whereas toothed whales (odontocetes) evolved a nasal vocal organ<sup>5</sup>, mysticetes have been thought to use the larynx for sound production<sup>1,6-8</sup>. However, there has been no direct demonstration that the mysticete larynx can phonate, or if it does, how it produces the great diversity of mysticete sounds<sup>9</sup>. Here we combine experiments on the excised larynx of three mysticete species with detailed anatomy and computational models to show that mysticetes evolved unique laryngeal structures for sound production. These structures allow some of the largest animals that ever lived to efficiently produce frequency-modulated, low-frequency calls. Furthermore, we show that this phonation mechanism is likely to be ancestral to all mysticetes and shares its fundamental physical basis with most terrestrial mammals, including humans<sup>10</sup>, birds<sup>11</sup>, and their closest relatives, odontocetes<sup>5</sup>. However, these laryngeal structures set insurmountable physiological limits to the frequency range and depth of their vocalizations, preventing them from escaping anthropogenic vessel noise<sup>12,13</sup> and communicating at great depths<sup>14</sup>, thereby greatly reducing their active communication range.",https://doi.org/10.1038/s41586-024-07080-1
Nature,2024-Mar,WNT signalling control by KDM5C during development affects cognition.,"Although KDM5C is one of the most frequently mutated genes in X-linked intellectual disability<sup>1</sup>, the exact mechanisms that lead to cognitive impairment remain unknown. Here we use human patient-derived induced pluripotent stem cells and Kdm5c knockout mice to conduct cellular, transcriptomic, chromatin and behavioural studies. KDM5C is identified as a safeguard to ensure that neurodevelopment occurs at an appropriate timescale, the disruption of which leads to intellectual disability. Specifically, there is a developmental window during which KDM5C directly controls WNT output to regulate the timely transition of primary to intermediate progenitor cells and consequently neurogenesis. Treatment with WNT signalling modulators at specific times reveal that only a transient alteration of the canonical WNT signalling pathway is sufficient to rescue the transcriptomic and chromatin landscapes in patient-derived cells and to induce these changes in wild-type cells. Notably, WNT inhibition during this developmental period also rescues behavioural changes of Kdm5c knockout mice. Conversely, a single injection of WNT3A into the brains of wild-type embryonic mice cause anxiety and memory alterations. Our work identifies KDM5C as a crucial sentinel for neurodevelopment and sheds new light on KDM5C mutation-associated intellectual disability. The results also increase our general understanding of memory and anxiety formation, with the identification of WNT functioning in a transient nature to affect long-lasting cognitive function.",https://doi.org/10.1038/s41586-024-07067-y
Nature,2024-Mar,B cells orchestrate tolerance to the neuromyelitis optica autoantigen AQP4.,"Neuromyelitis optica is a paradigmatic autoimmune disease of the central nervous system, in which the water-channel protein AQP4 is the target antigen<sup>1</sup>. The immunopathology in neuromyelitis optica is largely driven by autoantibodies to AQP4<sup>2</sup>. However, the T cell response that is required for the generation of these anti-AQP4 antibodies is not well understood. Here we show that B cells endogenously express AQP4 in response to activation with anti-CD40 and IL-21 and are able to present their endogenous AQP4 to T cells with an AQP4-specific T cell receptor (TCR). A population of thymic B cells emulates a CD40-stimulated B cell transcriptome, including AQP4 (in mice and humans), and efficiently purges the thymic TCR repertoire of AQP4-reactive clones. Genetic ablation of Aqp4 in B cells rescues AQP4-specific TCRs despite sufficient expression of AQP4 in medullary thymic epithelial cells, and B-cell-conditional AQP4-deficient mice are fully competent to raise AQP4-specific antibodies in productive germinal-centre responses. Thus, the negative selection of AQP4-specific thymocytes is dependent on the expression and presentation of AQP4 by thymic B cells. As AQP4 is expressed in B cells in a CD40-dependent (but not AIRE-dependent) manner, we propose that thymic B cells might tolerize against a group of germinal-centre-associated antigens, including disease-relevant autoantigens such as AQP4.",https://doi.org/10.1038/s41586-024-07079-8
Nature,2024-Mar,Making cities mental health friendly for adolescents and young adults.,"Urban life shapes the mental health of city dwellers, and although cities provide access to health, education and economic gain, urban environments are often detrimental to mental health<sup>1,2</sup>. Increasing urbanization over the next three decades will be accompanied by a growing population of children and adolescents living in cities<sup>3</sup>. Shaping the aspects of urban life that influence youth mental health could have an enormous impact on adolescent well-being and adult trajectories<sup>4</sup>. We invited a multidisciplinary, global group of researchers, practitioners, advocates and young people to complete sequential surveys to identify and prioritize the characteristics of a mental health-friendly city for young people. Here we show a set of ranked characteristic statements, grouped by personal, interpersonal, community, organizational, policy and environmental domains of intervention. Life skills for personal development, valuing and accepting young people's ideas and choices, providing safe public space for social connection, employment and job security, centring youth input in urban planning and design, and addressing adverse social determinants were priorities by domain. We report the adversities that COVID-19 generated and link relevant actions to these data. Our findings highlight the need for intersectoral, multilevel intervention and for inclusive, equitable, participatory design of cities that support youth mental health.",https://doi.org/10.1038/s41586-023-07005-4
Nature,2024-Mar,Genetic drivers of heterogeneity in type 2 diabetes pathophysiology.,"Type 2 diabetes (T2D) is a heterogeneous disease that develops through diverse pathophysiological processes<sup>1,2</sup> and molecular mechanisms that are often specific to cell type<sup>3,4</sup>. Here, to characterize the genetic contribution to these processes across ancestry groups, we aggregate genome-wide association study data from 2,535,601 individuals (39.7% not of European ancestry), including 428,452 cases of T2D. We identify 1,289 independent association signals at genome-wide significance (P < 5 × 10<sup>-8</sup>) that map to 611 loci, of which 145 loci are, to our knowledge, previously unreported. We define eight non-overlapping clusters of T2D signals that are characterized by distinct profiles of cardiometabolic trait associations. These clusters are differentially enriched for cell-type-specific regions of open chromatin, including pancreatic islets, adipocytes, endothelial cells and enteroendocrine cells. We build cluster-specific partitioned polygenic scores<sup>5</sup> in a further 279,552 individuals of diverse ancestry, including 30,288 cases of T2D, and test their association with T2D-related vascular outcomes. Cluster-specific partitioned polygenic scores are associated with coronary artery disease, peripheral artery disease and end-stage diabetic nephropathy across ancestry groups, highlighting the importance of obesity-related processes in the development of vascular outcomes. Our findings show the value of integrating multi-ancestry genome-wide association study data with single-cell epigenomics to disentangle the aetiological heterogeneity that drives the development and progression of T2D. This might offer a route to optimize global access to genetically informed diabetes care.",https://doi.org/10.1038/s41586-024-07019-6
Nature,2024-Mar,Genomic data in the All of Us Research Program.,"Comprehensively mapping the genetic basis of human disease across diverse individuals is a long-standing goal for the field of human genetics<sup>1-4</sup>. The All of Us Research Program is a longitudinal cohort study aiming to enrol a diverse group of at least one million individuals across the USA to accelerate biomedical research and improve human health<sup>5,6</sup>. Here we describe the programme's genomics data release of 245,388 clinical-grade genome sequences. This resource is unique in its diversity as 77% of participants are from communities that are historically under-represented in biomedical research and 46% are individuals from under-represented racial and ethnic minorities. All of Us identified more than 1 billion genetic variants, including more than 275 million previously unreported genetic variants, more than 3.9 million of which had coding consequences. Leveraging linkage between genomic data and the longitudinal electronic health record, we evaluated 3,724 genetic variants associated with 117 diseases and found high replication rates across both participants of European ancestry and participants of African ancestry. Summary-level data are publicly available, and individual-level data can be accessed by researchers through the All of Us Researcher Workbench using a unique data passport model with a median time from initial researcher registration to data access of 29 hours. We anticipate that this diverse dataset will advance the promise of genomic medicine for all.",https://doi.org/10.1038/s41586-023-06957-x
Nature,2024-Mar,Nuclear morphology is shaped by loop-extrusion programs.,"It is well established that neutrophils adopt malleable polymorphonuclear shapes to migrate through narrow interstitial tissue spaces<sup>1-3</sup>. However, how polymorphonuclear structures are assembled remains unknown<sup>4</sup>. Here we show that in neutrophil progenitors, halting loop extrusion-a motor-powered process that generates DNA loops by pulling in chromatin<sup>5</sup>-leads to the assembly of polymorphonuclear genomes. Specifically, we found that in mononuclear neutrophil progenitors, acute depletion of the loop-extrusion loading factor nipped-B-like protein (NIPBL) induced the assembly of horseshoe, banded, ringed and hypersegmented nuclear structures and led to a reduction in nuclear volume, mirroring what is observed during the differentiation of neutrophils. Depletion of NIPBL also induced cell-cycle arrest, activated a neutrophil-specific gene program and conditioned a loss of interactions across topologically associating domains to generate a chromatin architecture that resembled that of differentiated neutrophils. Removing NIPBL resulted in enrichment for mega-loops and interchromosomal hubs that contain genes associated with neutrophil-specific enhancer repertoires and an inflammatory gene program. On the basis of these observations, we propose that in neutrophil progenitors, loop-extrusion programs produce lineage-specific chromatin architectures that permit the packing of chromosomes into geometrically confined lobular structures. Our data also provide a blueprint for the assembly of polymorphonuclear structures, and point to the possibility of engineering de novo nuclear shapes to facilitate the migration of effector cells in densely populated tumorigenic environments.",https://doi.org/10.1038/s41586-024-07086-9
Nature,2024-Mar,Visuo-frontal interactions during social learning in freely moving macaques.,"Social interactions represent a ubiquitous aspect of our everyday life that we acquire by interpreting and responding to visual cues from conspecifics<sup>1</sup>. However, despite the general acceptance of this view, how visual information is used to guide the decision to cooperate is unknown. Here, we wirelessly recorded the spiking activity of populations of neurons in the visual and prefrontal cortex in conjunction with wireless recordings of oculomotor events while freely moving macaques engaged in social cooperation. As animals learned to cooperate, visual and executive areas refined the representation of social variables, such as the conspecific or reward, by distributing socially relevant information among neurons in each area. Decoding population activity showed that viewing social cues influences the decision to cooperate. Learning social events increased coordinated spiking between visual and prefrontal cortical neurons, which was associated with improved accuracy of neural populations to encode social cues and the decision to cooperate. These results indicate that the visual-frontal cortical network prioritizes relevant sensory information to facilitate learning social interactions while freely moving macaques interact in a naturalistic environment.",https://doi.org/10.1038/s41586-024-07084-x
Nature,2024-Mar,Rainforest transformation reallocates energy from green to brown food webs.,"Terrestrial animal biodiversity is increasingly being lost because of land-use change<sup>1,2</sup>. However, functional and energetic consequences aboveground and belowground and across trophic levels in megadiverse tropical ecosystems remain largely unknown. To fill this gap, we assessed changes in energy fluxes across 'green' aboveground (canopy arthropods and birds) and 'brown' belowground (soil arthropods and earthworms) animal food webs in tropical rainforests and plantations in Sumatra, Indonesia. Our results showed that most of the energy in rainforests is channelled to the belowground animal food web. Oil palm and rubber plantations had similar or, in the case of rubber agroforest, higher total animal energy fluxes compared to rainforest but the key energetic nodes were distinctly different: in rainforest more than 90% of the total animal energy flux was channelled by arthropods in soil and canopy, whereas in plantations more than 50% of the energy was allocated to annelids (earthworms). Land-use change led to a consistent decline in multitrophic energy flux aboveground, whereas belowground food webs responded with reduced energy flux to higher trophic levels, down to -90%, and with shifts from slow (fungal) to fast (bacterial) energy channels and from faeces production towards consumption of soil organic matter. This coincides with previously reported soil carbon stock depletion<sup>3</sup>. Here we show that well-documented animal biodiversity declines with tropical land-use change<sup>4-6</sup> are associated with vast energetic and functional restructuring in food webs across aboveground and belowground ecosystem compartments.",https://doi.org/10.1038/s41586-024-07083-y
Nature,2024-Mar,Nuclear export of circular RNA.,"Circular RNAs (circRNAs), which are increasingly being implicated in a variety of functions in normal and cancerous cells<sup>1-5</sup>, are formed by back-splicing of precursor mRNAs in the nucleus<sup>6-10</sup>. circRNAs are predominantly localized in the cytoplasm, indicating that they must be exported from the nucleus. Here we identify a pathway that is specific for the nuclear export of circular RNA. This pathway requires Ran-GTP, exportin-2 and IGF2BP1. Enhancing the nuclear Ran-GTP gradient by depletion or chemical inhibition of the major protein exporter CRM1 selectively increases the nuclear export of circRNAs, while reducing the nuclear Ran-GTP gradient selectively blocks circRNA export. Depletion or knockout of exportin-2 specifically inhibits nuclear export of circRNA. Analysis of nuclear circRNA-binding proteins reveals that interaction between IGF2BP1 and circRNA is enhanced by Ran-GTP. The formation of circRNA export complexes in the nucleus is promoted by Ran-GTP through its interactions with exportin-2, circRNA and IGF2BP1. Our findings demonstrate that adaptors such as IGF2BP1 that bind directly to circular RNAs recruit Ran-GTP and exportin-2 to export circRNAs in a mechanism that is analogous to protein export, rather than mRNA export.",https://doi.org/10.1038/s41586-024-07060-5
Nature,2024-Mar,Structure of human phagocyte NADPH oxidase in the activated state.,"Phagocyte NADPH oxidase, a protein complex with a core made up of NOX2 and p22 subunits, is responsible for transferring electrons from intracellular NADPH to extracellular oxygen<sup>1</sup>. This process generates superoxide anions that are vital for killing pathogens<sup>1</sup>. The activation of phagocyte NADPH oxidase requires membrane translocation and the binding of several cytosolic factors<sup>2</sup>. However, the exact mechanism by which cytosolic factors bind to and activate NOX2 is not well understood. Here we present the structure of the human NOX2-p22 complex activated by fragments of three cytosolic factors: p47, p67 and Rac1. The structure reveals that the p67-Rac1 complex clamps onto the dehydrogenase domain of NOX2 and induces its contraction, which stabilizes the binding of NADPH and results in a reduction of the distance between the NADPH-binding domain and the flavin adenine dinucleotide (FAD)-binding domain. Furthermore, the dehydrogenase domain docks onto the bottom of the transmembrane domain of NOX2, which reduces the distance between FAD and the inner haem. These structural rearrangements might facilitate the efficient transfer of electrons between the redox centres in NOX2 and lead to the activation of phagocyte NADPH oxidase.",https://doi.org/10.1038/s41586-024-07056-1
Nature,2024-Mar,Deep whole-genome analysis of 494 hepatocellular carcinomas.,"Over half of hepatocellular carcinoma (HCC) cases diagnosed worldwide are in China<sup>1-3</sup>. However, whole-genome analysis of hepatitis B virus (HBV)-associated HCC in Chinese individuals is limited<sup>4-8</sup>, with current analyses of HCC mainly from non-HBV-enriched populations<sup>9,10</sup>. Here we initiated the Chinese Liver Cancer Atlas (CLCA) project and performed deep whole-genome sequencing (average depth, 120×) of 494 HCC tumours. We identified 6 coding and 28 non-coding previously undescribed driver candidates. Five previously undescribed mutational signatures were found, including aristolochic-acid-associated indel and doublet base signatures, and a single-base-substitution signature that we termed SBS_H8. Pentanucleotide context analysis and experimental validation confirmed that SBS_H8 was distinct to the aristolochic-acid-associated SBS22. Notably, HBV integrations could take the form of extrachromosomal circular DNA, resulting in elevated copy numbers and gene expression. Our high-depth data also enabled us to characterize subclonal clustered alterations, including chromothripsis, chromoplexy and kataegis, suggesting that these catastrophic events could also occur in late stages of hepatocarcinogenesis. Pathway analysis of all classes of alterations further linked non-coding mutations to dysregulation of liver metabolism. Finally, we performed in vitro and in vivo assays to show that fibrinogen alpha chain (FGA), determined as both a candidate coding and non-coding driver, regulates HCC progression and metastasis. Our CLCA study depicts a detailed genomic landscape and evolutionary history of HCC in Chinese individuals, providing important clinical implications.",https://doi.org/10.1038/s41586-024-07054-3
Nature,2024-Mar,Genetic determinants of micronucleus formation in vivo.,"Genomic instability arising from defective responses to DNA damage<sup>1</sup> or mitotic chromosomal imbalances<sup>2</sup> can lead to the sequestration of DNA in aberrant extranuclear structures called micronuclei (MN). Although MN are a hallmark of ageing and diseases associated with genomic instability, the catalogue of genetic players that regulate the generation of MN remains to be determined. Here we analyse 997 mouse mutant lines, revealing 145 genes whose loss significantly increases (n = 71) or decreases (n = 74) MN formation, including many genes whose orthologues are linked to human disease. We found that mice null for Dscc1, which showed the most significant increase in MN, also displayed a range of phenotypes characteristic of patients with cohesinopathy disorders. After validating the DSCC1-associated MN instability phenotype in human cells, we used genome-wide CRISPR-Cas9 screening to define synthetic lethal and synthetic rescue interactors. We found that the loss of SIRT1 can rescue phenotypes associated with DSCC1 loss in a manner paralleling restoration of protein acetylation of SMC3. Our study reveals factors involved in maintaining genomic stability and shows how this information can be used to identify mechanisms that are relevant to human disease biology<sup>1</sup>.",https://doi.org/10.1038/s41586-023-07009-0
