Journal,Publication Date,Title,Abstract,DOI
Nature,2024-Feb,A rechargeable calcium-oxygen battery that operates at room temperature.,"Calcium-oxygen (Ca-O<sub>2</sub>) batteries can theoretically afford high capacity by the reduction of O<sub>2</sub> to calcium oxide compounds (CaO<sub>x</sub>) at low cost<sup>1-5</sup>. Yet, a rechargeable Ca-O<sub>2</sub> battery that operates at room temperature has not been achieved because the CaO<sub>x</sub>/O<sub>2</sub> chemistry typically involves inert discharge products and few electrolytes can accommodate both a highly reductive Ca metal anode and O<sub>2</sub>. Here we report a Ca-O<sub>2</sub> battery that is rechargeable for 700 cycles at room temperature. Our battery relies on a highly reversible two-electron redox to form chemically reactive calcium peroxide (CaO<sub>2</sub>) as the discharge product. Using a durable ionic liquid-based electrolyte, this two-electron reaction is enabled by the facilitated Ca plating-stripping in the Ca metal anode at room temperature and improved CaO<sub>2</sub>/O<sub>2</sub> redox in the air cathode. We show the proposed Ca-O<sub>2</sub> battery is stable in air and can be made into flexible fibres that are weaved into textile batteries for next-generation wearable systems.",https://doi.org/10.1038/s41586-023-06949-x
Nature,2024-Feb,A break in mitochondrial endosymbiosis as a basis for inflammatory diseases.,"Mitochondria retain bacterial traits due to their endosymbiotic origin, but host cells do not recognize them as foreign because the organelles are sequestered. However, the regulated release of mitochondrial factors into the cytosol can trigger cell death, innate immunity and inflammation. This selective breakdown in the 2-billion-year-old endosymbiotic relationship enables mitochondria to act as intracellular signalling hubs. Mitochondrial signals include proteins, nucleic acids, phospholipids, metabolites and reactive oxygen species, which have many modes of release from mitochondria, and of decoding in the cytosol and nucleus. Because these mitochondrial signals probably contribute to the homeostatic role of inflammation, dysregulation of these processes may lead to autoimmune and inflammatory diseases. A potential reason for the increased incidence of these diseases may be changes in mitochondrial function and signalling in response to such recent phenomena as obesity, dietary changes and other environmental factors. Focusing on the mixed heritage of mitochondria therefore leads to predictions for future insights, research paths and therapeutic opportunities. Thus, whereas mitochondria can be considered 'the enemy within' the cell, evolution has used this strained relationship in intriguing ways, with increasing evidence pointing to the recent failure of endosymbiosis being critical for the pathogenesis of inflammatory diseases.",https://doi.org/10.1038/s41586-023-06866-z
Nature,2024-Feb,Establishing reaction networks in the 16-electron sulfur reduction reaction.,"The sulfur reduction reaction (SRR) plays a central role in high-capacity lithium sulfur (Li-S) batteries. The SRR involves an intricate, 16-electron conversion process featuring multiple lithium polysulfide intermediates and reaction branches<sup>1-3</sup>. Establishing the complex reaction network is essential for rational tailoring of the SRR for improved Li-S batteries, but represents a daunting challenge<sup>4-6</sup>. Herein we systematically investigate the electrocatalytic SRR to decipher its network using the nitrogen, sulfur, dual-doped holey graphene framework as a model electrode to understand the role of electrocatalysts in acceleration of conversion kinetics. Combining cyclic voltammetry, in situ Raman spectroscopy and density functional theory calculations, we identify and directly profile the key intermediates (S<sub>8</sub>, Li<sub>2</sub>S<sub>8</sub>, Li<sub>2</sub>S<sub>6</sub>, Li<sub>2</sub>S<sub>4</sub> and Li<sub>2</sub>S) at varying potentials and elucidate their conversion pathways. Li<sub>2</sub>S<sub>4</sub> and Li<sub>2</sub>S<sub>6</sub> were predominantly observed, in which Li<sub>2</sub>S<sub>4</sub> represents the key electrochemical intermediate dictating the overall SRR kinetics. Li<sub>2</sub>S<sub>6</sub>, generated (consumed) through a comproportionation (disproportionation) reaction, does not directly participate in electrochemical reactions but significantly contributes to the polysulfide shuttling process. We found that the nitrogen, sulfur dual-doped holey graphene framework catalyst could help accelerate polysulfide conversion kinetics, leading to faster depletion of soluble lithium polysulfides at higher potential and hence mitigating the polysulfide shuttling effect and boosting output potential. These results highlight the electrocatalytic approach as a promising strategy for tackling the fundamental challenges regarding Li-S batteries.",https://doi.org/10.1038/s41586-023-06918-4
Nature,2024-Feb,Flexible silicon solar cells with high power-to-weight ratios.,"Silicon solar cells are a mainstay of commercialized photovoltaics, and further improving the power conversion efficiency of large-area and flexible cells remains an important research objective<sup>1,2</sup>. Here we report a combined approach to improving the power conversion efficiency of silicon heterojunction solar cells, while at the same time rendering them flexible. We use low-damage continuous-plasma chemical vapour deposition to prevent epitaxy, self-restoring nanocrystalline sowing and vertical growth to develop doped contacts, and contact-free laser transfer printing to deposit low-shading grid lines. High-performance cells of various thicknesses (55-130 μm) are fabricated, with certified efficiencies of 26.06% (57 μm), 26.19% (74 μm), 26.50% (84 μm), 26.56% (106 μm) and 26.81% (125 μm). The wafer thinning not only lowers the weight and cost, but also facilitates the charge migration and separation. It is found that the 57-μm flexible and thin solar cell shows the highest power-to-weight ratio (1.9 W g<sup>-1</sup>) and open-circuit voltage (761 mV) compared to the thick ones. All of the solar cells characterized have an area of 274.4 cm<sup>2</sup>, and the cell components ensure reliability in potential-induced degradation and light-induced degradation ageing tests. This technological progress provides a practical basis for the commercialization of flexible, lightweight, low-cost and highly efficient solar cells, and the ability to bend or roll up crystalline silicon solar cells for travel is anticipated.",https://doi.org/10.1038/s41586-023-06948-y
Nature,2024-Feb,"Stereodivergent 1,3-difunctionalization of alkenes by charge relocation.","Alkenes are indispensable feedstocks in chemistry. Functionalization at both carbons of the alkene-1,2-difunctionalization-is part of chemistry curricula worldwide<sup>1</sup>. Although difunctionalization at distal positions has been reported<sup>2-4</sup>, it typically relies on designer substrates featuring directing groups and/or stabilizing features, all of which determine the ultimate site of bond formation<sup>5-7</sup>. Here we introduce a method for the direct 1,3-difunctionalization of alkenes, based on a concept termed 'charge relocation', which enables stereodivergent access to 1,3-difunctionalized products of either syn- or anti-configuration from unactivated alkenes, without the need for directing groups or stabilizing features. The usefulness of the approach is demonstrated in the synthesis of the pulmonary toxin 4-ipomeanol and its derivatives.",https://doi.org/10.1038/s41586-023-06938-0
Nature,2024-Feb,High-quality semiconductor fibres via mechanical design.,"Recent breakthroughs in fibre technology have enabled the assembly of functional materials with intimate interfaces into a single fibre with specific geometries<sup>1-11</sup>, delivering diverse functionalities over a large area, for example, serving as sensors, actuators, energy harvesting and storage, display, and healthcare apparatus<sup>12-17</sup>. As semiconductors are the critical component that governs device performance, the selection, control and engineering of semiconductors inside fibres are the key pathways to enabling high-performance functional fibres. However, owing to stress development and capillary instability in the high-yield fibre thermal drawing, both cracks and deformations in the semiconductor cores considerably affect the performance of these fibres. Here we report a mechanical design to achieve ultralong, fracture-free and perturbation-free semiconductor fibres, guided by a study on stress development and capillary instability at three stages of the fibre formation: the viscous flow, the core crystallization and the subsequent cooling stage. Then, the exposed semiconductor wires can be integrated into a single flexible fibre with well-defined interfaces with metal electrodes, thereby achieving optoelectronic fibres and large-scale optoelectronic fabrics. This work provides fundamental insights into extreme mechanics and fluid dynamics with geometries that are inaccessible in traditional platforms, essentially addressing the increasing demand for flexible and wearable optoelectronics.",https://doi.org/10.1038/s41586-023-06946-0
Nature,2024-Feb,Durable CO<sub>2</sub> conversion in the proton-exchange membrane system.,"Electrolysis that reduces carbon dioxide (CO<sub>2</sub>) to useful chemicals can, in principle, contribute to a more sustainable and carbon-neutral future<sup>1-6</sup>. However, it remains challenging to develop this into a robust process because efficient conversion typically requires alkaline conditions in which CO<sub>2</sub> precipitates as carbonate, and this limits carbon utilization and the stability of the system<sup>7-12</sup>. Strategies such as physical washing, pulsed operation and the use of dipolar membranes can partially alleviate these problems but do not fully resolve them<sup>11,13-15</sup>. CO<sub>2</sub> electrolysis in acid electrolyte, where carbonate does not form, has therefore been explored as an ultimately more workable solution<sup>16-18</sup>. Herein we develop a proton-exchange membrane system that reduces CO<sub>2</sub> to formic acid at a catalyst that is derived from waste lead-acid batteries and in which a lattice carbon activation mechanism contributes. When coupling CO<sub>2</sub> reduction with hydrogen oxidation, formic acid is produced with over 93% Faradaic efficiency. The system is compatible with start-up/shut-down processes, achieves nearly 91% single-pass conversion efficiency for CO<sub>2</sub> at a current density of 600 mA cm<sup>-2</sup> and cell voltage of 2.2 V and is shown to operate continuously for more than 5,200 h. We expect that this exceptional performance, enabled by the use of a robust and efficient catalyst, stable three-phase interface and durable membrane, will help advance the development of carbon-neutral technologies.",https://doi.org/10.1038/s41586-023-06917-5
Nature,2024-Feb,Top-predator recovery abates geomorphic decline of a coastal ecosystem.,"The recovery of top predators is thought to have cascading effects on vegetated ecosystems and their geomorphology<sup>1,2</sup>, but the evidence for this remains correlational and intensely debated<sup>3,4</sup>. Here we combine observational and experimental data to reveal that recolonization of sea otters in a US estuary generates a trophic cascade that facilitates coastal wetland plant biomass and suppresses the erosion of marsh edges-a process that otherwise leads to the severe loss of habitats and ecosystem services<sup>5,6</sup>. Monitoring of the Elkhorn Slough estuary over several decades suggested top-down control in the system, because the erosion of salt marsh edges has generally slowed with increasing sea otter abundance, despite the consistently increasing physical stress in the system (that is, nutrient loading, sea-level rise and tidal scour<sup>7-9</sup>). Predator-exclusion experiments in five marsh creeks revealed that sea otters suppress the abundance of burrowing crabs, a top-down effect that cascades to both increase marsh edge strength and reduce marsh erosion. Multi-creek surveys comparing marsh creeks pre- and post-sea otter colonization confirmed the presence of an interaction between the keystone sea otter, burrowing crabs and marsh creeks, demonstrating the spatial generality of predator control of ecosystem edge processes: densities of burrowing crabs and edge erosion have declined markedly in creeks that have high levels of sea otter recolonization. These results show that trophic downgrading could be a strong but underappreciated contributor to the loss of coastal wetlands, and suggest that restoring top predators can help to re-establish geomorphic stability.",https://doi.org/10.1038/s41586-023-06959-9
Nature,2024-Feb,Designing a circular carbon and plastics economy for a sustainable future.,"The linear production and consumption of plastics today is unsustainable. It creates large amounts of unnecessary and mismanaged waste, pollution and carbon dioxide emissions, undermining global climate targets and the Sustainable Development Goals. This Perspective provides an integrated technological, economic and legal view on how to deliver a circular carbon and plastics economy that minimizes carbon dioxide emissions. Different pathways that maximize recirculation of carbon (dioxide) between plastics waste and feedstocks are outlined, including mechanical, chemical and biological recycling, and those involving the use of biomass and carbon dioxide. Four future scenarios are described, only one of which achieves sufficient greenhouse gas savings in line with global climate targets. Such a bold system change requires 50% reduction in future plastic demand, complete phase-out of fossil-derived plastics, 95% recycling rates of retrievable plastics and use of renewable energy. It is hard to overstate the challenge of achieving this goal. We therefore present a roadmap outlining the scale and timing of the economic and legal interventions that could possibly support this. Assessing the service lifespan and recoverability of plastic products, along with considerations of sufficiency and smart design, can moreover provide design principles to guide future manufacturing, use and disposal of plastics.",https://doi.org/10.1038/s41586-023-06939-z
Nature,2024-Feb,7-Dehydrocholesterol dictates ferroptosis sensitivity.,"Ferroptosis, a form of regulated cell death that is driven by iron-dependent phospholipid peroxidation, has been implicated in multiple diseases, including cancer<sup>1-3</sup>, degenerative disorders<sup>4</sup> and organ ischaemia-reperfusion injury (IRI)<sup>5,6</sup>. Here, using genome-wide CRISPR-Cas9 screening, we identified that the enzymes involved in distal cholesterol biosynthesis have pivotal yet opposing roles in regulating ferroptosis through dictating the level of 7-dehydrocholesterol (7-DHC)-an intermediate metabolite of distal cholesterol biosynthesis that is synthesized by sterol C5-desaturase (SC5D) and metabolized by 7-DHC reductase (DHCR7) for cholesterol synthesis. We found that the pathway components, including MSMO1, CYP51A1, EBP and SC5D, function as potential suppressors of ferroptosis, whereas DHCR7 functions as a pro-ferroptotic gene. Mechanistically, 7-DHC dictates ferroptosis surveillance by using the conjugated diene to exert its anti-phospholipid autoxidation function and shields plasma and mitochondria membranes from phospholipid autoxidation. Importantly, blocking the biosynthesis of endogenous 7-DHC by pharmacological targeting of EBP induces ferroptosis and inhibits tumour growth, whereas increasing the 7-DHC level by inhibiting DHCR7 effectively promotes cancer metastasis and attenuates the progression of kidney IRI, supporting a critical function of this axis in vivo. In conclusion, our data reveal a role of 7-DHC as a natural anti-ferroptotic metabolite and suggest that pharmacological manipulation of 7-DHC levels is a promising therapeutic strategy for cancer and IRI.",https://doi.org/10.1038/s41586-023-06983-9
Nature,2024-Feb,7-Dehydrocholesterol is an endogenous suppressor of ferroptosis.,"Ferroptosis is a form of cell death that has received considerable attention not only as a means to eradicate defined tumour entities but also because it provides unforeseen insights into the metabolic adaptation that tumours exploit to counteract phospholipid oxidation<sup>1,2</sup>. Here, we identify proferroptotic activity of 7-dehydrocholesterol reductase (DHCR7) and an unexpected prosurvival function of its substrate, 7-dehydrocholesterol (7-DHC). Although previous studies suggested that high concentrations of 7-DHC are cytotoxic to developing neurons by favouring lipid peroxidation<sup>3</sup>, we now show that 7-DHC accumulation confers a robust prosurvival function in cancer cells. Because of its far superior reactivity towards peroxyl radicals, 7-DHC effectively shields (phospho)lipids from autoxidation and subsequent fragmentation. We provide validation in neuroblastoma and Burkitt's lymphoma xenografts where we demonstrate that the accumulation of 7-DHC is capable of inducing a shift towards a ferroptosis-resistant state in these tumours ultimately resulting in a more aggressive phenotype. Conclusively, our findings provide compelling evidence of a yet-unrecognized antiferroptotic activity of 7-DHC as a cell-intrinsic mechanism that could be exploited by cancer cells to escape ferroptosis.",https://doi.org/10.1038/s41586-023-06878-9
Nature,2024-Feb,Ultracold field-linked tetratomic molecules.,"Ultracold polyatomic molecules offer opportunities<sup>1</sup> in cold chemistry<sup>2,3</sup>, precision measurements<sup>4</sup> and quantum information processing<sup>5,6</sup>, because of their rich internal structure. However, their increased complexity compared with diatomic molecules presents a challenge in using conventional cooling techniques. Here we demonstrate an approach to create weakly bound ultracold polyatomic molecules by electroassociation<sup>7</sup> (F.D. et al., manuscript in preparation) in a degenerate Fermi gas of microwave-dressed polar molecules through a field-linked resonance<sup>8-11</sup>. Starting from ground-state NaK molecules, we create around 1.1 × 10<sup>3</sup> weakly bound tetratomic (NaK)<sub>2</sub> molecules, with a phase space density of 0.040(3) at a temperature of 134(3) nK, more than 3,000 times colder than previously realized tetratomic molecules<sup>12</sup>. We observe a maximum tetramer lifetime of 8(2) ms in free space without a notable change in the presence of an optical dipole trap, indicating that these tetramers are collisionally stable. Moreover, we directly image the dissociated tetramers through microwave-field modulation to probe the anisotropy of their wavefunction in momentum space. Our result demonstrates a universal tool for assembling weakly bound ultracold polyatomic molecules from smaller polar molecules, which is a crucial step towards Bose-Einstein condensation of polyatomic molecules and towards a new crossover from a dipolar Bardeen-Cooper-Schrieffer superfluid<sup>13-15</sup> to a Bose-Einstein condensation of tetramers. Moreover, the long-lived field-linked state provides an ideal starting point for deterministic optical transfer to deeply bound tetramer states<sup>16-18</sup>.",https://doi.org/10.1038/s41586-023-06986-6
Nature,2024-Feb,Matrix viscoelasticity promotes liver cancer progression in the pre-cirrhotic liver.,"Type 2 diabetes mellitus is a major risk factor for hepatocellular carcinoma (HCC). Changes in extracellular matrix (ECM) mechanics contribute to cancer development<sup>1,2</sup>, and increased stiffness is known to promote HCC progression in cirrhotic conditions<sup>3,4</sup>. Type 2 diabetes mellitus is characterized by an accumulation of advanced glycation end-products (AGEs) in the ECM; however, how this affects HCC in non-cirrhotic conditions is unclear. Here we find that, in patients and animal models, AGEs promote changes in collagen architecture and enhance ECM viscoelasticity, with greater viscous dissipation and faster stress relaxation, but not changes in stiffness. High AGEs and viscoelasticity combined with oncogenic β-catenin signalling promote HCC induction, whereas inhibiting AGE production, reconstituting the AGE clearance receptor AGER1 or breaking AGE-mediated collagen cross-links reduces viscoelasticity and HCC growth. Matrix analysis and computational modelling demonstrate that lower interconnectivity of AGE-bundled collagen matrix, marked by shorter fibre length and greater heterogeneity, enhances viscoelasticity. Mechanistically, animal studies and 3D cell cultures show that enhanced viscoelasticity promotes HCC cell proliferation and invasion through an integrin-β1-tensin-1-YAP mechanotransductive pathway. These results reveal that AGE-mediated structural changes enhance ECM viscoelasticity, and that viscoelasticity can promote cancer progression in vivo, independent of stiffness.",https://doi.org/10.1038/s41586-023-06991-9
Nature,2024-Feb,Single-photon superradiance in individual caesium lead halide quantum dots.,"The brightness of an emitter is ultimately described by Fermi's golden rule, with a radiative rate proportional to its oscillator strength times the local density of photonic states. As the oscillator strength is an intrinsic material property, the quest for ever brighter emission has relied on the local density of photonic states engineering, using dielectric or plasmonic resonators<sup>1,2</sup>. By contrast, a much less explored avenue is to boost the oscillator strength, and hence the emission rate, using a collective behaviour termed superradiance. Recently, it was proposed<sup>3</sup> that the latter can be realized using the giant oscillator-strength transitions of a weakly confined exciton in a quantum well when its coherent motion extends over many unit cells. Here we demonstrate single-photon superradiance in perovskite quantum dots with a sub-100 picosecond radiative decay time, almost as short as the reported exciton coherence time<sup>4</sup>. The characteristic dependence of radiative rates on the size, composition and temperature of the quantum dot suggests the formation of giant transition dipoles, as confirmed by effective-mass calculations. The results aid in the development of ultrabright, coherent quantum light sources and attest that quantum effects, for example, single-photon emission, persist in nanoparticles ten times larger than the exciton Bohr radius.",https://doi.org/10.1038/s41586-023-07001-8
Nature,2024-Feb,Fertilizer management for global ammonia emission reduction.,"Crop production is a large source of atmospheric ammonia (NH<sub>3</sub>), which poses risks to air quality, human health and ecosystems<sup>1-5</sup>. However, estimating global NH<sub>3</sub> emissions from croplands is subject to uncertainties because of data limitations, thereby limiting the accurate identification of mitigation options and efficacy<sup>4,5</sup>. Here we develop a machine learning model for generating crop-specific and spatially explicit NH<sub>3</sub> emission factors globally (5-arcmin resolution) based on a compiled dataset of field observations. We show that global NH<sub>3</sub> emissions from rice, wheat and maize fields in 2018 were 4.3 ± 1.0 Tg N yr<sup>-1</sup>, lower than previous estimates that did not fully consider fertilizer management practices<sup>6-9</sup>. Furthermore, spatially optimizing fertilizer management, as guided by the machine learning model, has the potential to reduce the NH<sub>3</sub> emissions by about 38% (1.6 ± 0.4 Tg N yr<sup>-1</sup>) without altering total fertilizer nitrogen inputs. Specifically, we estimate potential NH<sub>3</sub> emissions reductions of 47% (44-56%) for rice, 27% (24-28%) for maize and 26% (20-28%) for wheat cultivation, respectively. Under future climate change scenarios, we estimate that NH<sub>3</sub> emissions could increase by 4.0 ± 2.7% under SSP1-2.6 and 5.5 ± 5.7% under SSP5-8.5 by 2030-2060. However, targeted fertilizer management has the potential to mitigate these increases.",https://doi.org/10.1038/s41586-024-07020-z
