Journal,Publication Date,Title,Abstract,DOI
Nature,2024-Apr,A massive galaxy that formed its stars at z ≈ 11.,"The formation of galaxies by gradual hierarchical co-assembly of baryons and cold dark matter halos is a fundamental paradigm underpinning modern astrophysics<sup>1,2</sup> and predicts a strong decline in the number of massive galaxies at early cosmic times<sup>3-5</sup>. Extremely massive quiescent galaxies (stellar masses of more than 10<sup>11</sup> M<sub>⊙</sub>) have now been observed as early as 1-2 billion years after the Big Bang<sup>6-13</sup>. These galaxies are extremely constraining on theoretical models, as they had formed 300-500 Myr earlier, and only some models can form massive galaxies this early<sup>12,14</sup>. Here we report on the spectroscopic observations with the JWST of a massive quiescent galaxy ZF-UDS-7329 at redshift 3.205 ± 0.005. It has eluded deep ground-based spectroscopy<sup>8</sup>, it is significantly redder than is typical and its spectrum reveals features typical of much older stellar populations. Detailed modelling shows that its stellar population formed around 1.5 billion years earlier in time (z ≈ 11) at an epoch when dark matter halos of sufficient hosting mass had not yet assembled in the standard scenario<sup>4,5</sup>. This observation may indicate the presence of undetected populations of early galaxies and the possibility of significant gaps in our understanding of early stellar populations, galaxy formation and the nature of dark matter.",https://doi.org/10.1038/s41586-024-07191-9
Nature,2024-Apr,Alkene dialkylation by triple radical sorting.,"The development of bimolecular homolytic substitution (S<sub>H</sub>2) catalysis has expanded cross-coupling chemistries by enabling the selective combination of any primary radical with any secondary or tertiary radical through a radical sorting mechanism<sup>1-8</sup>. Biomimetic<sup>9,10</sup> S<sub>H</sub>2 catalysis can be used to merge common feedstock chemicals-such as alcohols, acids and halides-in various permutations for the construction of a single C(sp<sup>3</sup>)-C(sp<sup>3</sup>) bond. The ability to sort these two distinct radicals across commercially available alkenes in a three-component manner would enable the simultaneous construction of two C(sp<sup>3</sup>)-C(sp<sup>3</sup>) bonds, greatly accelerating access to complex molecules and drug-like chemical space<sup>11</sup>. However, the simultaneous in situ formation of electrophilic and primary nucleophilic radicals in the presence of unactivated alkenes is problematic, typically leading to statistical radical recombination, hydrogen atom transfer, disproportionation and other deleterious pathways<sup>12,13</sup>. Here we report the use of bimolecular homolytic substitution catalysis to sort an electrophilic radical and a nucleophilic radical across an unactivated alkene. This reaction involves the in situ formation of three distinct radical species, which are then differentiated by size and electronics, allowing for regioselective formation of the desired dialkylated products. This work accelerates access to pharmaceutically relevant C(sp<sup>3</sup>)-rich molecules and defines a distinct mechanistic approach for alkene dialkylation.",https://doi.org/10.1038/s41586-024-07165-x
Nature,2024-Mar,Optomechanical realization of the bosonic Kitaev chain.,"The fermionic Kitaev chain is a canonical model featuring topological Majorana zero modes<sup>1</sup>. We report the experimental realization of its bosonic analogue<sup>2</sup> in a nano-optomechanical network, in which the parametric interactions induce beam-splitter coupling and two-mode squeezing among the nanomechanical modes, analogous to hopping and p-wave pairing in the fermionic case, respectively. This specific structure gives rise to a set of extraordinary phenomena in the bosonic dynamics and transport. We observe quadrature-dependent chiral amplification, exponential scaling of the gain with system size and strong sensitivity to boundary conditions. All these are linked to the unique non-Hermitian topological nature of the bosonic Kitaev chain. We probe the topological phase transition and uncover a rich dynamical phase diagram by controlling interaction phases and amplitudes. Finally, we present an experimental demonstration of an exponentially enhanced response to a small perturbation<sup>3,4</sup>. These results represent the demonstration of a new synthetic phase of matter whose bosonic dynamics do not have fermionic parallels, and we have established a powerful system for studying non-Hermitian topology and its applications for signal manipulation and sensing.",https://doi.org/10.1038/s41586-024-07174-w
Nature,2024-Mar,A figure of merit for efficiency roll-off in TADF-based organic LEDs.,"Organic light-emitting diodes (OLEDs) are a revolutionary light-emitting display technology that has been successfully commercialized in mobile phones and televisions<sup>1,2</sup>. The injected charges form both singlet and triplet excitons, and for high efficiency it is important to enable triplets as well as singlets to emit light. At present, materials that harvest triplets by thermally activated delayed fluorescence (TADF) are a very active field of research as an alternative to phosphorescent emitters that usually use heavy metal atoms<sup>3,4</sup>. Although excellent progress has been made, in most TADF OLEDs there is a severe decrease of efficiency as the drive current is increased, known as efficiency roll-off. So far, much of the literature suggests that efficiency roll-off should be reduced by minimizing the energy difference between singlet and triplet excited states (ΔE<sub>ST</sub>) to maximize the rate of conversion of triplets to singlets by means of reverse intersystem crossing (k<sub>RISC</sub>)<sup>5-20</sup>. We analyse the efficiency roll-off in a wide range of TADF OLEDs and find that neither of these parameters fully accounts for the reported efficiency roll-off. By considering the dynamic equilibrium between singlets and triplets in TADF materials, we propose a figure of merit for materials design to reduce efficiency roll-off and discuss its correlation with reported data of TADF OLEDs. Our new figure of merit will guide the design and development of TADF materials that can reduce efficiency roll-off. It will help improve the efficiency of TADF OLEDs at realistic display operating conditions and expand the use of TADF materials to applications that require high brightness, such as lighting, augmented reality and lasing.",https://doi.org/10.1038/s41586-024-07149-x
Nature,2024-Mar,High-fidelity spin qubit operation and algorithmic initialization above 1 K.,"The encoding of qubits in semiconductor spin carriers has been recognized as a promising approach to a commercial quantum computer that can be lithographically produced and integrated at scale<sup>1-10</sup>. However, the operation of the large number of qubits required for advantageous quantum applications<sup>11-13</sup> will produce a thermal load exceeding the available cooling power of cryostats at millikelvin temperatures. As the scale-up accelerates, it becomes imperative to establish fault-tolerant operation above 1 K, at which the cooling power is orders of magnitude higher<sup>14-18</sup>. Here we tune up and operate spin qubits in silicon above 1 K, with fidelities in the range required for fault-tolerant operations at these temperatures<sup>19-21</sup>. We design an algorithmic initialization protocol to prepare a pure two-qubit state even when the thermal energy is substantially above the qubit energies and incorporate radiofrequency readout to achieve fidelities up to 99.34% for both readout and initialization. We also demonstrate single-qubit Clifford gate fidelities up to 99.85% and a two-qubit gate fidelity of 98.92%. These advances overcome the fundamental limitation that the thermal energy must be well below the qubit energies for the high-fidelity operation to be possible, surmounting a main obstacle in the pathway to scalable and fault-tolerant quantum computation.",https://doi.org/10.1038/s41586-024-07160-2
Nature,2024-Mar,Five million years of Antarctic Circumpolar Current strength variability.,"The Antarctic Circumpolar Current (ACC) represents the world's largest ocean-current system and affects global ocean circulation, climate and Antarctic ice-sheet stability<sup>1-3</sup>. Today, ACC dynamics are controlled by atmospheric forcing, oceanic density gradients and eddy activity<sup>4</sup>. Whereas palaeoceanographic reconstructions exhibit regional heterogeneity in ACC position and strength over Pleistocene glacial-interglacial cycles<sup>5-8</sup>, the long-term evolution of the ACC is poorly known. Here we document changes in ACC strength from sediment cores in the Pacific Southern Ocean. We find no linear long-term trend in ACC flow since 5.3 million years ago (Ma), in contrast to global cooling<sup>9</sup> and increasing global ice volume<sup>10</sup>. Instead, we observe a reversal on a million-year timescale, from increasing ACC strength during Pliocene global cooling to a subsequent decrease with further Early Pleistocene cooling. This shift in the ACC regime coincided with a Southern Ocean reconfiguration that altered the sensitivity of the ACC to atmospheric and oceanic forcings<sup>11-13</sup>. We find ACC strength changes to be closely linked to 400,000-year eccentricity cycles, probably originating from modulation of precessional changes in the South Pacific jet stream linked to tropical Pacific temperature variability<sup>14</sup>. A persistent link between weaker ACC flow, equatorward-shifted opal deposition and reduced atmospheric CO<sub>2</sub> during glacial periods first emerged during the Mid-Pleistocene Transition (MPT). The strongest ACC flow occurred during warmer-than-present intervals of the Plio-Pleistocene, providing evidence of potentially increasing ACC flow with future climate warming.",https://doi.org/10.1038/s41586-024-07143-3
Nature,2024-Mar,High-threshold and low-overhead fault-tolerant quantum memory.,"The accumulation of physical errors<sup>1-3</sup> prevents the execution of large-scale algorithms in current quantum computers. Quantum error correction<sup>4</sup> promises a solution by encoding k logical qubits onto a larger number n of physical qubits, such that the physical errors are suppressed enough to allow running a desired computation with tolerable fidelity. Quantum error correction becomes practically realizable once the physical error rate is below a threshold value that depends on the choice of quantum code, syndrome measurement circuit and decoding algorithm<sup>5</sup>. We present an end-to-end quantum error correction protocol that implements fault-tolerant memory on the basis of a family of low-density parity-check codes<sup>6</sup>. Our approach achieves an error threshold of 0.7% for the standard circuit-based noise model, on par with the surface code<sup>7-10</sup> that for 20 years was the leading code in terms of error threshold. The syndrome measurement cycle for a length-n code in our family requires n ancillary qubits and a depth-8 circuit with CNOT gates, qubit initializations and measurements. The required qubit connectivity is a degree-6 graph composed of two edge-disjoint planar subgraphs. In particular, we show that 12 logical qubits can be preserved for nearly 1 million syndrome cycles using 288 physical qubits in total, assuming the physical error rate of 0.1%, whereas the surface code would require nearly 3,000 physical qubits to achieve said performance. Our findings bring demonstrations of a low-overhead fault-tolerant quantum memory within the reach of near-term quantum processors.",https://doi.org/10.1038/s41586-024-07107-7
Nature,2024-Mar,Thermonuclear explosions on neutron stars reveal the speed of their jets.,"Relativistic jets are observed from accreting and cataclysmic transients throughout the Universe, and have a profound impact on their surroundings<sup>1,2</sup>. Despite their importance, their launch mechanism is not known. For accreting neutron stars, the speed of their compact jets can reveal whether the jets are powered by magnetic fields anchored in the accretion flow<sup>3</sup> or in the star itself<sup>4,5</sup>, but so far no such measurements exist. These objects can show bright explosions on their surface due to unstable thermonuclear burning of recently accreted material, called type-I X-ray bursts<sup>6</sup>, during which the mass-accretion rate increases<sup>7-9</sup>. Here, we report on bright flares in the jet emission for a few minutes after each X-ray burst, attributed to the increased accretion rate. With these flares, we measure the speed of a neutron star compact jet to be <math xmlns=""http://www.w3.org/1998/Math/MathML""><mrow><mi>v</mi> <mo>=</mo> <msubsup><mrow><mn>0.38</mn></mrow> <mrow><mo>-</mo> <mn>0.08</mn></mrow> <mrow><mo>+</mo> <mn>0.11</mn></mrow> </msubsup> <mi>c</mi></mrow> </math> , much slower than those from black holes at similar luminosities. This discovery provides a powerful new tool in which we can determine the role that individual system properties have on the jet speed, revealing the dominant jet launching mechanism.",https://doi.org/10.1038/s41586-024-07133-5
Nature,2024-Mar,Controlling the helicity of light by electrical magnetization switching.,"Controlling the intensity of emitted light and charge current is the basis of transferring and processing information<sup>1</sup>. By contrast, robust information storage and magnetic random-access memories are implemented using the spin of the carrier and the associated magnetization in ferromagnets<sup>2</sup>. The missing link between the respective disciplines of photonics, electronics and spintronics is to modulate the circular polarization of the emitted light, rather than its intensity, by electrically controlled magnetization. Here we demonstrate that this missing link is established at room temperature and zero applied magnetic field in light-emitting diodes<sup>2-7</sup>, through the transfer of angular momentum between photons, electrons and ferromagnets. With spin-orbit torque<sup>8-11</sup>, a charge current generates also a spin current to electrically switch the magnetization. This switching determines the spin orientation of injected carriers into semiconductors, in which the transfer of angular momentum from the electron spin to photon controls the circular polarization of the emitted light<sup>2</sup>. The spin-photon conversion with the nonvolatile control of magnetization opens paths to seamlessly integrate information transfer, processing and storage. Our results provide substantial advances towards electrically controlled ultrafast modulation of circular polarization and spin injection with magnetization dynamics for the next-generation information and communication technology<sup>12</sup>, including space-light data transfer. The same operating principle in scaled-down structures or using two-dimensional materials will enable transformative opportunities for quantum information processing with spin-controlled single-photon sources, as well as for implementing spin-dependent time-resolved spectroscopies.",https://doi.org/10.1038/s41586-024-07125-5
Nature,2024-Mar,The complex circumstellar environment of supernova 2023ixf.,"The early evolution of a supernova (SN) can reveal information about the environment and the progenitor star. When a star explodes in vacuum, the first photons to escape from its surface appear as a brief, hours-long shock-breakout flare<sup>1,2</sup>, followed by a cooling phase of emission. However, for stars exploding within a distribution of dense, optically thick circumstellar material (CSM), the first photons escape from the material beyond the stellar edge and the duration of the initial flare can extend to several days, during which the escaping emission indicates photospheric heating<sup>3</sup>. Early serendipitous observations<sup>2,4</sup> that lacked ultraviolet (UV) data were unable to determine whether the early emission is heating or cooling and hence the nature of the early explosion event. Here we report UV spectra of the nearby SN 2023ixf in the galaxy Messier 101 (M101). Using the UV data as well as a comprehensive set of further multiwavelength observations, we temporally resolve the emergence of the explosion shock from a thick medium heated by the SN emission. We derive a reliable bolometric light curve that indicates that the shock breaks out from a dense layer with a radius substantially larger than typical supergiants.",https://doi.org/10.1038/s41586-024-07116-6
Nature,2024-Mar,Disease-associated astrocyte epigenetic memory promotes CNS pathology.,"Disease-associated astrocyte subsets contribute to the pathology of neurologic diseases, including multiple sclerosis and experimental autoimmune encephalomyelitis<sup>1-8</sup> (EAE), an experimental model for multiple sclerosis. However, little is known about the stability of these astrocyte subsets and their ability to integrate past stimulation events. Here we report the identification of an epigenetically controlled memory astrocyte subset that exhibits exacerbated pro-inflammatory responses upon rechallenge. Specifically, using a combination of single-cell RNA sequencing, assay for transposase-accessible chromatin with sequencing, chromatin immunoprecipitation with sequencing, focused interrogation of cells by nucleic acid detection and sequencing, and cell-specific in vivo CRISPR-Cas9-based genetic perturbation studies we established that astrocyte memory is controlled by the metabolic enzyme ATP-citrate lyase (ACLY), which produces acetyl coenzyme A (acetyl-CoA) that is used by histone acetyltransferase p300 to control chromatin accessibility. The number of ACLY<sup>+</sup>p300<sup>+</sup> memory astrocytes is increased in acute and chronic EAE models, and their genetic inactivation ameliorated EAE. We also detected the pro-inflammatory memory phenotype in human astrocytes in vitro; single-cell RNA sequencing and immunohistochemistry studies detected increased numbers of ACLY<sup>+</sup>p300<sup>+</sup> astrocytes in chronic multiple sclerosis lesions. In summary, these studies define an epigenetically controlled memory astrocyte subset that promotes CNS pathology in EAE and, potentially, multiple sclerosis. These findings may guide novel therapeutic approaches for multiple sclerosis and other neurologic diseases.",https://doi.org/10.1038/s41586-024-07187-5
Nature,2024-Mar,Resilient anatomy and local plasticity of naive and stress haematopoiesis.,"The bone marrow adjusts blood cell production to meet physiological demands in response to insults. The spatial organization of normal and stress responses are unknown owing to the lack of methods to visualize most steps of blood production. Here we develop strategies to image multipotent haematopoiesis, erythropoiesis and lymphopoiesis in mice. We combine these with imaging of myelopoiesis<sup>1</sup> to define the anatomy of normal and stress haematopoiesis. In the steady state, across the skeleton, single stem cells and multipotent progenitors distribute through the marrow enriched near megakaryocytes. Lineage-committed progenitors are recruited to blood vessels, where they contribute to lineage-specific microanatomical structures composed of progenitors and immature cells, which function as the production sites for each major blood lineage. This overall anatomy is resilient to insults, as it was maintained after haemorrhage, systemic bacterial infection and granulocyte colony-stimulating factor (G-CSF) treatment, and during ageing. Production sites enable haematopoietic plasticity as they differentially and selectively modulate their numbers and output in response to insults. We found that stress responses are variable across the skeleton: the tibia and the sternum respond in opposite ways to G-CSF, and the skull does not increase erythropoiesis after haemorrhage. Our studies enable in situ analyses of haematopoiesis, define the anatomy of normal and stress responses, identify discrete microanatomical production sites that confer plasticity to haematopoiesis, and uncover unprecedented heterogeneity of stress responses across the skeleton.",https://doi.org/10.1038/s41586-024-07186-6
Nature,2024-Mar,Non-reciprocal topological solitons in active metamaterials.,"From protein motifs<sup>1</sup> to black holes<sup>2</sup>, topological solitons are pervasive nonlinear excitations that are robust and can be driven by external fields<sup>3</sup>. So far, existing driving mechanisms all accelerate solitons and antisolitons in opposite directions<sup>3,4</sup>. Here we introduce a local driving mechanism for solitons that accelerates both solitons and antisolitons in the same direction instead: non-reciprocal driving. To realize this mechanism, we construct an active mechanical metamaterial consisting of non-reciprocally coupled oscillators<sup>5-8</sup> subject to a bistable potential<sup>9-14</sup>. We find that such nonlinearity coaxes non-reciprocal excitations-so-called non-Hermitian skin waves<sup>5-8,15-22</sup>, which are typically unstable-into robust one-way (anti)solitons. We harness such non-reciprocal topological solitons by constructing an active waveguide capable of transmitting and filtering unidirectional information. Finally, we illustrate this mechanism in another class of metamaterials that shows the breaking of 'supersymmetry'<sup>23,24</sup> causing only antisolitons to be driven. Our observations and models demonstrate a subtle interplay between non-reciprocity and topological solitons, whereby solitons create their own driving force by locally straining the material. Beyond the scope of our study, non-reciprocal solitons might provide an efficient driving mechanism for robotic locomotion<sup>25</sup> and could emerge in other settings, for example, quantum mechanics<sup>26,27</sup>, optics<sup>28-30</sup> and soft matter<sup>31</sup>.",https://doi.org/10.1038/s41586-024-07097-6
Nature,2024-Mar,Pattern formation by turbulent cascades.,"Fully developed turbulence is a universal and scale-invariant chaotic state characterized by an energy cascade from large to small scales at which the cascade is eventually arrested by dissipation<sup>1-6</sup>. Here we show how to harness these seemingly structureless turbulent cascades to generate patterns. Pattern formation entails a process of wavelength selection, which can usually be traced to the linear instability of a homogeneous state<sup>7</sup>. By contrast, the mechanism we propose here is fully nonlinear. It is triggered by the non-dissipative arrest of turbulent cascades: energy piles up at an intermediate scale, which is neither the system size nor the smallest scales at which energy is usually dissipated. Using a combination of theory and large-scale simulations, we show that the tunable wavelength of these cascade-induced patterns can be set by a non-dissipative transport coefficient called odd viscosity, ubiquitous in chiral fluids ranging from bioactive to quantum systems<sup>8-12</sup>. Odd viscosity, which acts as a scale-dependent Coriolis-like force, leads to a two-dimensionalization of the flow at small scales, in contrast with rotating fluids in which a two-dimensionalization occurs at large scales<sup>4</sup>. Apart from odd viscosity fluids, we discuss how cascade-induced patterns can arise in natural systems, including atmospheric flows<sup>13-19</sup>, stellar plasma such as the solar wind<sup>20-22</sup>, or the pulverization and coagulation of objects or droplets in which mass rather than energy cascades<sup>23-25</sup>.",https://doi.org/10.1038/s41586-024-07074-z
Nature,2024-Mar,Global prediction of extreme floods in ungauged watersheds.,"Floods are one of the most common natural disasters, with a disproportionate impact in developing countries that often lack dense streamflow gauge networks<sup>1</sup>. Accurate and timely warnings are critical for mitigating flood risks<sup>2</sup>, but hydrological simulation models typically must be calibrated to long data records in each watershed. Here we show that artificial intelligence-based forecasting achieves reliability in predicting extreme riverine events in ungauged watersheds at up to a five-day lead time that is similar to or better than the reliability of nowcasts (zero-day lead time) from a current state-of-the-art global modelling system (the Copernicus Emergency Management Service Global Flood Awareness System). In addition, we achieve accuracies over five-year return period events that are similar to or better than current accuracies over one-year return period events. This means that artificial intelligence can provide flood warnings earlier and over larger and more impactful events in ungauged basins. The model developed here was incorporated into an operational early warning system that produces publicly available (free and open) forecasts in real time in over 80 countries. This work highlights a need for increasing the availability of hydrological data to continue to improve global access to reliable flood warnings.",https://doi.org/10.1038/s41586-024-07145-1
